{
  "id": "patricia",
  "name": "Patricia",
  "role": "Gründerin & Bachata",
  "isFounder": true,
  "image": "/src/assets/images/team/patricia.png",
  "imagePosition": "object-top",
  "instagram": "https://instagram.com/idiomadanza",
  "bio": [
    {
      "icon": "🎓",
      "text": "Bachata Sensual Instructor Level 1"
    },
    {
      "icon": "🥈",
      "text": "Social Dance Competition J&J Strasbourg 2022"
    },
    {
      "icon": "🥉",
      "text": "Social Dance Competition J&J Wien 2023"
    }
  ]
}