{
  "name": "Stephan",
  "role": "Gründer & Bachata",
  "isFounder": true,
  "image": "../../assets/images/team/stephan.jpg",
  "imagePosition": "object-top",
  "instagram": "https://instagram.com/idiomadanza",
  "bio": [
    {
      "icon": "🎓",
      "text": "Bachata Sensual Instructor Level 2"
    },
    {
      "icon": "🥈",
      "text": "Social Dance Competition Pro Division 2024"
    }
  ]
}