{
  "id": "chris_und_nalini",
  "name": "Chris & Nalini",
  "role": "Gründer-Duo",
  "isFounder": true,
  "image": "../../assets/images/team/chris_und_nalini.png",
  "imagePosition": "object-top",
  "instagram": "https://www.instagram.com/chrishart_91/",
  "founderQuote": "\"Unsere Passion ist der authentische Ausdruck des Bachata Sensual. Wir lehren mit Fokus auf die fundierte Technik und Ästhetik nach den Begründern Korke & Judith.\""
}